{"admission_id":"admit-dra-bipower-jumpiness-entry-admission-v1","authorization":"RESEARCH_ONLY_NOT_SHADOW_PAPER_OR_LIVE","candidate_path":{"existing_adapter_or_direct_runner":true,"implementation_before_economic_test":"DENY","matched_comparator_id":"DRA_V1_EQUAL_EQUITY_250_WHOLE_LOT_240_COMPARATOR","maximum_additional_research_steps":1,"parent_strategy_id":"BTC_DRA_V1_EQUAL_EQUITY_250_USDT","positive_next_step":"FROZEN_HYPOTHESIS_MANIFEST","runner_id":"BTC_DRA_DECLARATIVE_ENTRY_ADMISSION_RUNNER_V1","status":"DIRECT_TO_FROZEN_HYPOTHESIS"},"decision_time":{"availability_rule":"At each unchanged DRA complete-UTC-day decision, all 24 hourly closes for the just-completed day, the immediately preceding close and every ratio in the prior 20-complete-day median are known before the next-open fill; no incomplete day or later return is used.","availability_status":"KNOWN_BEFORE_DECISION","decision_clock":"UNCHANGED_DRA_COMPLETE_UTC_DAY_DECISION_BEFORE_NEXT_OPEN_FILL","feature_name":"DAILY_REALIZED_TO_BIPOWER_VARIATION_RATIO_TO_PRIOR_20D_MEDIAN","post_outcome_dependency":"DENY"},"dispatch_id":"manager-dra-bipower-jumpiness-entry-admission-v1","dispatch_sha256":"5266b7965d68a6aae6919c06a4f81b37cb3fae1c8aa6ee43933db61b7ed6c2f2","disposition":{"independent_forward_or_oos_boundary_preserved":true,"insufficient_stops_without_permission":true,"negative_closes_family":true},"document_type":"LOCAL_RESEARCH_STRATEGY_PATH_V1","economics":{"adverse_slippage_required":true,"drawdown_required":true,"equal_capital_comparator_required":true,"fees_required":true,"holding_age_required":true,"inventory_path_required":true,"total_pnl_required":true},"evidence_bindings":{"decision_feature":{"kind":"TASK_MESSAGE","locator":"Decision feature: DAILY_REALIZED_TO_BIPOWER_VARIATION_RATIO_TO_PRIOR_20D_MEDIAN. For the latest complete UTC day, compute exactly 24 simple hourly close-to-close returns using the immediately preceding close, realized variance as their squared sum, and bipower variation as pi/2 times the 23 adjacent absolute-return products. Divide RV by BV, then divide that ratio by the median of exactly the prior 20 complete-day ratios. Admit only at or below the frozen threshold. Non-positive variation, later bars, log-return substitution, truncation, alternate sampling, formulas, lookbacks or thresholds are forbidden.","sha256":null,"subject_id":"DAILY_REALIZED_TO_BIPOWER_VARIATION_RATIO_TO_PRIOR_20D_MEDIAN"},"execution_runner":{"kind":"REPOSITORY_PATH","locator":"research/btc_dra_declarative_entry_admission_v1.py","sha256":"ad2998274e3ca8728e1e5d371c1516f2ef7135e8f2c830f213816ea3b668f7e5","subject_id":"BTC_DRA_DECLARATIVE_ENTRY_ADMISSION_RUNNER_V1"},"matched_comparator":{"kind":"REPOSITORY_PATH","locator":"docs/dra-declarative-entry-admission-v1.md","sha256":"8e24b694b70a2fc7275bce2ab5360c3bede4503698d5f600640420e308ce3a63","subject_id":"DRA_V1_EQUAL_EQUITY_250_WHOLE_LOT_240_COMPARATOR"},"parent_strategy":{"kind":"REPOSITORY_PATH","locator":"docs/btc-dra-runtime-v1.md","sha256":"eddff4af35c9f46b6487297feb64cfd7ceedf6a829aa7981c407f5479b889b60","subject_id":"BTC_DRA_V1_EQUAL_EQUITY_250_USDT"}},"intent_id":"intent-dra-bipower-jumpiness-entry-admission-v1","intent_sha256":"d1ea83327bf73a17d098c73e174d3368fa69fd32b37995a86c4b5ff4da99fe01","issued_at":"2026-08-15T13:11:20Z","manager_thread_id":"019fca63-4f8f-71e3-9d88-297bca468eb9","output_class":"MECHANISM_CONCLUSION","schema_version":"1","state_authority":"SERVER_CANONICAL","task_id":"local-node-dra-bipower-jumpiness-entry-admission-v1","task_sha256":"86fc63f282c06da2067d8e92353b3b21b6a82447a9261e7eafba5eec9afa4edb","timer_authority":"CODEX_CLOUD_OPS_ONLY"}
