{"admission_id":"admit-dra-long-trend-entry-admission-v1","authorization":"RESEARCH_ONLY_NOT_SHADOW_PAPER_OR_LIVE","candidate_path":{"existing_adapter_or_direct_runner":true,"implementation_before_economic_test":"DENY","matched_comparator_id":"DRA_V1_EQUAL_EQUITY_250_WHOLE_LOT_240_COMPARATOR","maximum_additional_research_steps":1,"parent_strategy_id":"BTC_DAILY_REVERSAL_ACCUMULATION_V1_250_USDT","positive_next_step":"FROZEN_HYPOTHESIS_MANIFEST","runner_id":"BTC_DRA_LONG_TREND_ENTRY_ADMISSION_RUNNER_V1","status":"DIRECT_TO_FROZEN_HYPOTHESIS"},"decision_time":{"availability_rule":"At the original DRA V1 complete UTC-day decision close, the current close and every one of the prior 200 complete daily closes are available; the mean is computed before the current close is appended and no later bar or incomplete day is used.","availability_status":"KNOWN_BEFORE_DECISION","decision_clock":"Every unchanged DRA V1 complete UTC-day entry decision before its next-open fill","feature_name":"CURRENT_COMPLETE_UTC_DAY_CLOSE_ABOVE_PRIOR_200_COMPLETE_DAY_SMA","post_outcome_dependency":"DENY"},"dispatch_id":"manager-dra-long-trend-entry-admission-v1","dispatch_sha256":"80e40d8d2863a3b36fac1c5897b2c8eaaf304702a6ebd9bf30f5a42a94a9e628","disposition":{"independent_forward_or_oos_boundary_preserved":true,"insufficient_stops_without_permission":true,"negative_closes_family":true},"document_type":"LOCAL_RESEARCH_STRATEGY_PATH_V1","economics":{"adverse_slippage_required":true,"drawdown_required":true,"equal_capital_comparator_required":true,"fees_required":true,"holding_age_required":true,"inventory_path_required":true,"total_pnl_required":true},"evidence_bindings":{"decision_feature":{"kind":"TASK_MESSAGE","locator":"Decision feature: CURRENT_COMPLETE_UTC_DAY_CLOSE_ABOVE_PRIOR_200_COMPLETE_DAY_SMA. At each original DRA V1 decision close, compare that complete UTC-day close with the arithmetic mean of exactly the prior 200 complete UTC-day closes; admit only when strictly above. At hard data inception only, fewer than 200 prior days must fall back to admitting the unchanged parent signal and must be counted. No current incomplete day, later bar, EMA substitute, threshold, neighbor or parameter sweep is permitted.","sha256":null,"subject_id":"CURRENT_COMPLETE_UTC_DAY_CLOSE_ABOVE_PRIOR_200_COMPLETE_DAY_SMA"},"execution_runner":{"kind":"REPOSITORY_PATH","locator":"research/btc_dra_long_trend_entry_admission_v1.py","sha256":"56f0b8d2a8ae624a26e96ac380e6cfcc6713c3c8e590185e8da1e6de9e22263e","subject_id":"BTC_DRA_LONG_TREND_ENTRY_ADMISSION_RUNNER_V1"},"matched_comparator":{"kind":"REPOSITORY_PATH","locator":"docs/btc-dra-long-trend-entry-admission-runner-v1.md","sha256":"7f34ec633944dabee6a9d76e6e57b324cd987459f09b1aa7cd5d0628ad2d3b35","subject_id":"DRA_V1_EQUAL_EQUITY_250_WHOLE_LOT_240_COMPARATOR"},"parent_strategy":{"kind":"REPOSITORY_PATH","locator":"docs/btc-dra-runtime-v1.md","sha256":"eddff4af35c9f46b6487297feb64cfd7ceedf6a829aa7981c407f5479b889b60","subject_id":"BTC_DAILY_REVERSAL_ACCUMULATION_V1_250_USDT"}},"intent_id":"intent-dra-long-trend-entry-admission-v1","intent_sha256":"13a6d7452e6638600b3eb817eb589dc294c857517cf92be232a96bb6ec0b8cf9","issued_at":"2026-08-15T08:23:00Z","manager_thread_id":"019fca63-4f8f-71e3-9d88-297bca468eb9","output_class":"MECHANISM_CONCLUSION","schema_version":"1","state_authority":"SERVER_CANONICAL","task_id":"local-node-dra-long-trend-entry-admission-v1","task_sha256":"89ea609bd6e146811b83c54ccb51b6472600d6f53e50c2f07be3dffb19bc0609","timer_authority":"CODEX_CLOUD_OPS_ONLY"}
