{"admission_id":"admit-btc-daily-cci14-hysteresis-long-cash-v1","authorization":"RESEARCH_ONLY_NOT_SHADOW_PAPER_OR_LIVE","candidate_path":{"existing_adapter_or_direct_runner":true,"implementation_before_economic_test":"DENY","matched_comparator_id":"FULL_CAPITAL_BTC_BUY_AND_HOLD_SAME_WINDOW_COST_AND_VALUATION","maximum_additional_research_steps":1,"parent_strategy_id":"FULL_CAPITAL_BTC_BUY_AND_HOLD_SAME_WINDOW_COST_AND_VALUATION","positive_next_step":"FROZEN_HYPOTHESIS_MANIFEST","runner_id":"BTC_DAILY_CCI14_HYSTERESIS_LONG_CASH_RUNNER_V1","status":"DIRECT_TO_FROZEN_HYPOTHESIS"},"decision_time":{"availability_rule":"All daily high, low and close inputs through completed day D and the prior thirteen completed days are known before the next H1 open; no incomplete day or later bar is used.","availability_status":"KNOWN_BEFORE_DECISION","decision_clock":"COMPLETE_UTC_DAY_CLOSE_BEFORE_NEXT_H1_OPEN","feature_name":"COMPLETE_UTC_DAY_TALIB_FORMULA_CCI14_SYMMETRIC_HYSTERESIS_75_100_125","post_outcome_dependency":"DENY"},"dispatch_id":"manager-btc-daily-cci14-hysteresis-long-cash-v1","dispatch_sha256":"1f40e8edf01093e828eb307ef33aeda5675874aa7c8e85aa55c1a5ea2c31f650","disposition":{"independent_forward_or_oos_boundary_preserved":true,"insufficient_stops_without_permission":true,"negative_closes_family":true},"document_type":"LOCAL_RESEARCH_STRATEGY_PATH_V1","economics":{"adverse_slippage_required":true,"drawdown_required":true,"equal_capital_comparator_required":true,"fees_required":true,"holding_age_required":true,"inventory_path_required":true,"total_pnl_required":true},"evidence_bindings":{"decision_feature":{"kind":"REPOSITORY_PATH","locator":"research_pipeline/examples/btc-daily-cci14-hysteresis-long-cash-historical.v1.manifest.json","sha256":"df1402cff7c6e89f87853180aedbd7d2cec8e890a544b2af762249f85ea03840","subject_id":"COMPLETE_UTC_DAY_TALIB_FORMULA_CCI14_SYMMETRIC_HYSTERESIS_75_100_125"},"execution_runner":{"kind":"REPOSITORY_PATH","locator":"research/btc_daily_cci14_hysteresis_long_cash_historical.py","sha256":"544b7329e3df920d84112b2556e064e3301e202d4957cbe76268d674d0a07c00","subject_id":"BTC_DAILY_CCI14_HYSTERESIS_LONG_CASH_RUNNER_V1"},"matched_comparator":{"kind":"REPOSITORY_PATH","locator":"research/btc_daily_chaikin_money_flow_long_cash_historical.py","sha256":"5c43069168824670dcda0c6ec0c4f7d08389e8dcc718246ff57390ed872927bd","subject_id":"FULL_CAPITAL_BTC_BUY_AND_HOLD_SAME_WINDOW_COST_AND_VALUATION"},"parent_strategy":{"kind":"REPOSITORY_PATH","locator":"research/btc_monthly_12m_time_series_momentum_historical.py","sha256":"6682a56f08f70435064e4fdd2394350e418f9a2f5cd76c02ec936c6ee8802c1b","subject_id":"FULL_CAPITAL_BTC_BUY_AND_HOLD_SAME_WINDOW_COST_AND_VALUATION"}},"intent_id":"intent-btc-daily-cci14-hysteresis-long-cash-v1","intent_sha256":"e6bbeb886744fb69cffbfff82c9e4295f9c375a27e445e17e7b33552dd0191a8","issued_at":"2026-08-22T10:35:30Z","manager_thread_id":"019fca63-4f8f-71e3-9d88-297bca468eb9","output_class":"MECHANISM_CONCLUSION","schema_version":"1","state_authority":"SERVER_CANONICAL","task_id":"local-node-btc-daily-cci14-hysteresis-long-cash-v1","task_sha256":"98448bea0313db9c069c669c2ced4937522ad70ec15deb9980368b17adc4bd63","timer_authority":"CODEX_CLOUD_OPS_ONLY"}
