{"admission_id":"admit-btc-binance-usdm-funding-carry-v3","authorization":"RESEARCH_ONLY_NOT_SHADOW_PAPER_OR_LIVE","candidate_path":{"existing_adapter_or_direct_runner":true,"implementation_before_economic_test":"DENY","matched_comparator_id":"ZERO_YIELD_CASH_SAME_INITIAL_EQUITY_AND_WINDOW","maximum_additional_research_steps":1,"parent_strategy_id":"QUARTERLY_RESET_EQUAL_QUANTITY_BTC_SPOT_LONG_PERPETUAL_SHORT","positive_next_step":"FROZEN_HYPOTHESIS_MANIFEST","runner_id":"BTC_BINANCE_USDM_DELTA_NEUTRAL_FUNDING_CARRY_RUNNER_V3","status":"DIRECT_TO_FROZEN_HYPOTHESIS"},"decision_time":{"availability_rule":"Every hourly spot, contract, mark and index price and each funding rate comes only from publisher-checksummed pre-2025 archives. Quarter-start execution uses the 01:00 UTC open only after the 00:00 funding observation; no later bar or post-2024 observation is available to a decision.","availability_status":"KNOWN_BEFORE_DECISION","decision_clock":"QUARTER_START_01_00_UTC_AFTER_00_00_FUNDING","feature_name":"SIGNED_BINANCE_USDM_BTCUSDT_FUNDING_RECEIPT","post_outcome_dependency":"DENY"},"dispatch_id":"manager-btc-binance-usdm-funding-carry-v3","dispatch_sha256":"c991f07f8dce685891f9ef7bd87ac74509e1a482048d981faf1266b6d6ffdf9f","disposition":{"independent_forward_or_oos_boundary_preserved":true,"insufficient_stops_without_permission":true,"negative_closes_family":true},"document_type":"LOCAL_RESEARCH_STRATEGY_PATH_V1","economics":{"adverse_slippage_required":true,"drawdown_required":true,"equal_capital_comparator_required":true,"fees_required":true,"holding_age_required":true,"inventory_path_required":true,"total_pnl_required":true},"evidence_bindings":{"decision_feature":{"kind":"REPOSITORY_PATH","locator":"research_pipeline/examples/btc-binance-usdm-delta-neutral-funding-carry-historical.v3.manifest.json","sha256":"80875ee81027a9c6794319a0acf3648d4ce94c4cf5307e923834f72c20a1fcb6","subject_id":"SIGNED_BINANCE_USDM_BTCUSDT_FUNDING_RECEIPT"},"execution_runner":{"kind":"REPOSITORY_PATH","locator":"research/btc_binance_usdm_delta_neutral_funding_carry_historical.py","sha256":"2821b762b9d685a1a70ddbb28066dea75ce255d7150143a35a7838370dfc499e","subject_id":"BTC_BINANCE_USDM_DELTA_NEUTRAL_FUNDING_CARRY_RUNNER_V3"},"matched_comparator":{"kind":"REPOSITORY_PATH","locator":"research_pipeline/examples/btc-binance-usdm-delta-neutral-funding-carry-historical.v3.manifest.json","sha256":"80875ee81027a9c6794319a0acf3648d4ce94c4cf5307e923834f72c20a1fcb6","subject_id":"ZERO_YIELD_CASH_SAME_INITIAL_EQUITY_AND_WINDOW"},"parent_strategy":{"kind":"REPOSITORY_PATH","locator":"research_pipeline/examples/btc-binance-usdm-delta-neutral-funding-carry-v3.hypothesis.json","sha256":"d26714f9ea11b232f109864b45216b1bfb23d3b9ee860c39fe367f81375daaf1","subject_id":"QUARTERLY_RESET_EQUAL_QUANTITY_BTC_SPOT_LONG_PERPETUAL_SHORT"}},"intent_id":"intent-btc-binance-usdm-funding-carry-v3","intent_sha256":"e19c7d397e5e5a9b6325aabdf266d7c3af97198fa3a5e673b0fb29c812ca2b8e","issued_at":"2026-08-22T12:00:30Z","manager_thread_id":"019fca63-4f8f-71e3-9d88-297bca468eb9","output_class":"MECHANISM_CONCLUSION","schema_version":"1","state_authority":"SERVER_CANONICAL","task_id":"local-node-btc-binance-usdm-funding-carry-v3","task_sha256":"abcb3ae75a92fc944a85f103df553a06afabf05cf70106a6f0a9392dfc70426d","timer_authority":"CODEX_CLOUD_OPS_ONLY"}
