{"admission_id":"admit-btc-daily-nr7-volatility-contraction-breakout-v1","authorization":"RESEARCH_ONLY_NOT_SHADOW_PAPER_OR_LIVE","candidate_path":{"existing_adapter_or_direct_runner":true,"implementation_before_economic_test":"DENY","matched_comparator_id":"FULL_CAPITAL_BTC_BUY_AND_HOLD_SAME_WINDOW_COST_AND_VALUATION","maximum_additional_research_steps":1,"parent_strategy_id":"IDENTICAL_PRIOR_COMPLETE_DAY_HIGH_BREAKOUT_168H_LONG_CASH_POLICY_WITHOUT_NR_FILTER","positive_next_step":"FROZEN_HYPOTHESIS_MANIFEST","runner_id":"BTC_DAILY_NR7_VOLATILITY_CONTRACTION_BREAKOUT_RUNNER_V1","status":"DIRECT_TO_FROZEN_HYPOTHESIS"},"decision_time":{"availability_rule":"The setup day's 24 complete UTC H1 bars and previous complete-day close are known before the following UTC day begins. Only a complete H1 close on that immediately following day can trigger, and execution waits for the next H1 open; no later bar enters the setup or trigger decision.","availability_status":"KNOWN_BEFORE_DECISION","decision_clock":"COMPLETE_UTC_SETUP_DAY_THEN_NEXT_DAY_COMPLETE_H1_CLOSE_BEFORE_NEXT_H1_OPEN","feature_name":"STRICT_NR7_NORMALIZED_TRUE_RANGE_CONTRACTION_BEFORE_NEXT_DAY_PRIOR_HIGH_BREAKOUT","post_outcome_dependency":"DENY"},"dispatch_id":"manager-btc-daily-nr7-volatility-contraction-breakout-v1","dispatch_sha256":"f0b08606615f1e3040c766de7ec24bbb7c10967ab87f79e75903ba1038e07ca2","disposition":{"independent_forward_or_oos_boundary_preserved":true,"insufficient_stops_without_permission":true,"negative_closes_family":true},"document_type":"LOCAL_RESEARCH_STRATEGY_PATH_V1","economics":{"adverse_slippage_required":true,"drawdown_required":true,"equal_capital_comparator_required":true,"fees_required":true,"holding_age_required":true,"inventory_path_required":true,"total_pnl_required":true},"evidence_bindings":{"decision_feature":{"kind":"REPOSITORY_PATH","locator":"research_pipeline/examples/btc-daily-nr7-volatility-contraction-breakout-historical.v1.manifest.json","sha256":"fcc9121b98f705c6e502cc4bfac1780efa8934b526d171ef09d510969980bfe0","subject_id":"STRICT_NR7_NORMALIZED_TRUE_RANGE_CONTRACTION_BEFORE_NEXT_DAY_PRIOR_HIGH_BREAKOUT"},"execution_runner":{"kind":"REPOSITORY_PATH","locator":"research/btc_daily_nr7_volatility_contraction_breakout_historical.py","sha256":"0403de054c3e5b4c55d91f5f9c6d552fb57c3a806298a5617ed9bd11b019ced4","subject_id":"BTC_DAILY_NR7_VOLATILITY_CONTRACTION_BREAKOUT_RUNNER_V1"},"matched_comparator":{"kind":"REPOSITORY_PATH","locator":"research_pipeline/examples/btc-daily-nr7-volatility-contraction-breakout-historical.v1.manifest.json","sha256":"fcc9121b98f705c6e502cc4bfac1780efa8934b526d171ef09d510969980bfe0","subject_id":"FULL_CAPITAL_BTC_BUY_AND_HOLD_SAME_WINDOW_COST_AND_VALUATION"},"parent_strategy":{"kind":"REPOSITORY_PATH","locator":"research_pipeline/examples/btc-daily-nr7-volatility-contraction-breakout-historical.v1.manifest.json","sha256":"fcc9121b98f705c6e502cc4bfac1780efa8934b526d171ef09d510969980bfe0","subject_id":"IDENTICAL_PRIOR_COMPLETE_DAY_HIGH_BREAKOUT_168H_LONG_CASH_POLICY_WITHOUT_NR_FILTER"}},"intent_id":"intent-btc-daily-nr7-volatility-contraction-breakout-v1","intent_sha256":"bf09eb2999d0a28d3c87550b72bb06bcc5bab500a82dab6a4b16989cddb0b169","issued_at":"2026-08-24T12:24:30Z","manager_thread_id":"019fca63-4f8f-71e3-9d88-297bca468eb9","output_class":"MECHANISM_CONCLUSION","schema_version":"1","state_authority":"SERVER_CANONICAL","task_id":"local-node-btc-daily-nr7-volatility-contraction-breakout-v1","task_sha256":"212c9d153675cfa95a825aedb4fd92fd6321ceae1f898a046b64b3f849b1b02e","timer_authority":"CODEX_CLOUD_OPS_ONLY"}
